{
  "environment": {
    "references": [],
    "state_roots": [
      {
        "host": "claude-code",
        "path": "/tmp/stewards-fixture/claude-state"
      }
    ]
  },
  "provisioner_version": "0.1.0",
  "request_id": "123e4567-e89b-42d3-a456-426614174000",
  "schema_version": 1,
  "targets": [
    {
      "environment_ref_ids": [],
      "host": "claude-code",
      "plugins": [
        {
          "package_version": "latest",
          "plugin_id": "grove",
          "route_id": "claude-code.local"
        }
      ],
      "surface_id": "claude-code.local.interactive"
    }
  ]
}
