{
  "environment": {
    "references": [],
    "state_roots": [
      {
        "host": "codex",
        "path": "/tmp/stewards-fixture/codex-state"
      }
    ]
  },
  "provisioner_version": "0.1.0",
  "request_id": "123e4567-e89b-42d3-a456-426614174000",
  "schema_version": 1,
  "targets": [
    {
      "environment_ref_ids": [],
      "host": "codex",
      "plugins": [
        {
          "package_version": "1.2.3",
          "plugin_id": "grove",
          "route_id": "codex.local"
        }
      ],
      "surface_id": "codex.local.interactive"
    }
  ]
}
